{
  "project": {"name": "idlebrain", "version": "mvp-1.0"},
  "input": {
    "slice_dir": "data/raw_slices",
    "slice_glob": "*.tif",
    "sampling_mode": "merge5",
    "slice_interval_n": 5,
    "pixel_size_um_xy": 0.65,
    "slice_spacing_um": 25.0,
    "bit_depth": 16,
    "channel_map": {"red": 0, "green": 1, "farred": 2},
    "active_channel": "red"
  },
  "target": {
    "marker": "unspecified",
    "signal_type": "cyto"
  },
  "compute": {
    "device": "cuda",
    "gpu_name": "RTX 3070 Ti",
    "vram_gb": 8
  },
  "registration": {
    "mode": "2d_slice_with_3d_smoothness",
    "auto_first": true,
    "fail_score_threshold": 0.65,
    "landmark_fallback": true,
    "landmark_max_slices": 5
  },
  "detection": {
    "primary_model": "cellpose_cyto2",
    "secondary_model": "cellpose_nuclei",
    "merge_primary_secondary": false,
    "cellpose_gpu": true,
    "cellpose_diameter_um": 12.0,
    "cellpose_channels": [0, 0],
    "cellpose_flow_threshold": 0.4,
    "cellpose_cellprob_threshold": 0.0,
    "cellpose_min_size_px": 8,
    "within_slice_dedup_px": 4.0,
    "fallback_model": "log",
    "fallback_log_min_sigma": 1.2,
    "fallback_log_max_sigma": 5.0,
    "fallback_log_num_sigma": 8,
    "fallback_log_threshold_rel": 0.03,
    "fallback_min_distance": 8,
    "fallback_threshold": 200.0,
    "auto_switch_on_distortion": true
  },
  "dedup": {
    "enabled": true,
    "method": "kdtree",
    "neighbor_slices": 1,
    "r_xy_um": 6.0,
    "r_z_rule": "slice_spacing_um*0.5"
  },
  "outputs": {
    "leaf_csv": "outputs/cell_counts_leaf.csv",
    "hierarchy_csv": "outputs/cell_counts_hierarchy.csv",
    "qc_dir": "outputs/qc_overlays"
  }
}

